{
  "$schema": "https://masa.sonicfield.org/schemas/0.1.0/matter-record.schema.json",
  "masaVersion": "0.1.0",
  "id": "urn:uuid:00000000-0000-4000-8000-000000000003",
  "type": "masa:MatterRecord",
  "revision": 1,
  "profiles": [
    "core",
    "audio",
    "transformation"
  ],
  "createdAt": "2026-07-27T12:00:00Z",
  "createdBy": "urn:uuid:00000000-0000-4000-8000-000000000101",
  "title": "Lineage-preserving transformation",
  "description": "A representation is registered without claiming that it is identical to a physical event or perceptual object.",
  "actors": [
    {
      "id": "urn:uuid:00000000-0000-4000-8000-000000000101",
      "type": "masa:Actor",
      "actorKind": "human",
      "roles": [
        "record-creator"
      ],
      "name": {
        "state": "known",
        "value": "Local example author"
      },
      "disclosure": "private",
      "extensions": {}
    }
  ],
  "sources": [],
  "representations": [
    {
      "id": "urn:uuid:00000000-0000-4000-8000-000000000601",
      "type": "masa:Representation",
      "role": "source-representation",
      "mediaType": "audio/wav",
      "format": {
        "state": "unknown",
        "reason": "The example does not include source bytes.",
        "reasonCode": "not_bundled"
      },
      "availability": "unavailable",
      "locator": {
        "state": "unavailable",
        "reason": "No asset is bundled with this minimal example.",
        "reasonCode": "not_bundled"
      },
      "integrity": {
        "state": "unknown",
        "reason": "Integrity cannot be verified without bytes.",
        "reasonCode": "not_bundled"
      },
      "policyRefs": [
        "urn:uuid:00000000-0000-4000-8000-000000000301"
      ],
      "disclosure": "private",
      "extensions": {},
      "audio": {
        "durationSeconds": {
          "state": "known",
          "value": 1
        },
        "channels": {
          "state": "known",
          "value": 1
        },
        "sampleRateHz": {
          "state": "known",
          "value": 48000
        },
        "bitDepth": {
          "state": "known",
          "value": 24
        },
        "encoding": {
          "state": "known",
          "value": "PCM signed integer little-endian"
        },
        "spatialFormat": {
          "state": "known",
          "value": "mono"
        },
        "levelContext": {
          "state": "unknown",
          "reason": "No calibrated playback or capture level is attached to this fixture.",
          "reasonCode": "not_calibrated"
        }
      }
    },
    {
      "id": "urn:uuid:00000000-0000-4000-8000-000000000602",
      "type": "masa:Representation",
      "role": "derivative",
      "mediaType": "audio/wav",
      "format": {
        "state": "known",
        "value": "WAVE PCM derivative; bytes omitted from fixture"
      },
      "availability": "unavailable",
      "locator": {
        "state": "unavailable",
        "reason": "No asset is bundled with this minimal example.",
        "reasonCode": "not_bundled"
      },
      "integrity": {
        "state": "unknown",
        "reason": "Integrity cannot be verified without bytes.",
        "reasonCode": "not_bundled"
      },
      "policyRefs": [
        "urn:uuid:00000000-0000-4000-8000-000000000301"
      ],
      "disclosure": "private",
      "extensions": {},
      "audio": {
        "durationSeconds": {
          "state": "known",
          "value": 1
        },
        "channels": {
          "state": "known",
          "value": 1
        },
        "sampleRateHz": {
          "state": "known",
          "value": 48000
        },
        "bitDepth": {
          "state": "known",
          "value": 24
        },
        "encoding": {
          "state": "known",
          "value": "PCM signed integer little-endian"
        },
        "spatialFormat": {
          "state": "known",
          "value": "mono"
        },
        "levelContext": {
          "state": "unknown",
          "reason": "No calibrated playback or capture level is attached to this fixture.",
          "reasonCode": "not_calibrated"
        }
      }
    }
  ],
  "encounters": [],
  "apertures": [],
  "listeningPasses": [],
  "claims": [],
  "regions": [],
  "measurements": [],
  "observations": [],
  "mappings": [],
  "relations": [
    {
      "id": "urn:uuid:00000000-0000-4000-8000-000000000605",
      "type": "masa:Relation",
      "subject": "urn:uuid:00000000-0000-4000-8000-000000000602",
      "predicate": "masa:derived-from",
      "object": "urn:uuid:00000000-0000-4000-8000-000000000601",
      "assertedBy": "urn:uuid:00000000-0000-4000-8000-000000000101",
      "createdAt": "2026-07-27T12:01:01Z",
      "basis": [
        {
          "ref": "urn:uuid:00000000-0000-4000-8000-000000000603",
          "role": "operation"
        }
      ],
      "operationRef": "urn:uuid:00000000-0000-4000-8000-000000000603",
      "extensions": {}
    }
  ],
  "policies": [
    {
      "id": "urn:uuid:00000000-0000-4000-8000-000000000301",
      "type": "masa:Policy",
      "policyKind": "composite",
      "issuer": "urn:uuid:00000000-0000-4000-8000-000000000101",
      "status": "active",
      "disclosure": "private",
      "rules": [
        {
          "id": "urn:uuid:00000000-0000-4000-8000-000000000302",
          "effect": "permission",
          "actions": [
            "read",
            "validate",
            "transform"
          ],
          "targets": [
            "urn:uuid:00000000-0000-4000-8000-000000000003"
          ],
          "subjects": [
            "urn:uuid:00000000-0000-4000-8000-000000000101"
          ],
          "authorityBasis": {
            "state": "known",
            "value": "Local creator declaration for this private example"
          },
          "constraints": {
            "network": "prohibited"
          },
          "duties": [
            "Preserve provenance and unknown states"
          ]
        }
      ],
      "review": {
        "contact": {
          "state": "unknown",
          "reason": "No external contact exists for a local fixture.",
          "reasonCode": "local_fixture"
        },
        "route": {
          "state": "known",
          "value": "Review the record with the local MASA CLI"
        }
      },
      "extensions": {}
    }
  ],
  "contexts": [],
  "agentRuns": [],
  "capabilities": [],
  "integrity": {
    "state": "unknown",
    "reason": "The standalone example is an account rather than a bundled byte artifact.",
    "reasonCode": "not_bundled"
  },
  "history": {
    "mode": "external",
    "href": "events.ndjson",
    "eventIds": [
      "urn:uuid:00000000-0000-4000-8000-000000000603"
    ]
  },
  "disclosure": "private",
  "registers": [
    "digital-technical"
  ],
  "scales": [
    "object-event"
  ],
  "extensions": {
    "example:roundtrip": {
      "deep": {
        "values": [
          "preserve",
          "without-interpretation"
        ]
      }
    }
  }
}
